<?xml version="1.0" encoding="UTF-8"?>

<!DOCTYPE enums PUBLIC 
		"-//ninecube//enumer1.0//EN" 
		"http://www.ninecube.net/saturn/enumer.dtd">

<enums>
	<enum name="user.role" desc="用户角色">
		<type value="3" desc="系统管理员" />
		<type value="2" desc="A部门管理员" />
		<type value="1" desc="操作员" />
	</enum>
	
	<enum name="yesno" desc="是否" >
		<type value="true" desc="是" />
		<type value="false" desc="否" />
	</enum>
</enums>